{
  "$schema": "https://json-schema.org/draft/2020-12/schema",
  "title": "PharmacyProductBatch",
  "type": "object",
  "required": ["scraped_at", "pharmacy_name", "items_count", "products"],
  "properties": {
    "scraped_at": {
      "type": "string",
      "format": "date-time",
      "description": "Timestamp ISO 8601 de la extracción (UTC)"
    },
    "pharmacy_name": {
      "type": "string",
      "enum": ["Cruz Verde", "Salcobrand", "Farmacias Ahumada", "Dr. Simi", "Redfarma", "Otra"]
    },
    "source_url": {
      "type": "string",
      "format": "uri"
    },
    "items_count": {
      "type": "integer"
    },
    "products": {
      "type": "array",
      "items": {
        "type": "object",
        "required": [
          "sku",
          "name",
          "brand",
          "price_regular",
          "in_stock",
          "product_url"
        ],
        "properties": {
          "sku": {
            "type": "string",
            "description": "Identificador único asignado por la farmacia"
          },
          "name": {
            "type": "string",
            "description": "Nombre comercial completo del fármaco/producto"
          },
          "active_ingredient": {
            "type": ["string", "null"],
            "description": "Principio activo (ej. Paracetamol, Ibuprofeno)"
          },
          "dosage": {
            "type": ["string", "null"],
            "description": "Dosis / Concentración (ej. 500 mg, 10 mg/ml)"
          },
          "presentation": {
            "type": ["string", "null"],
            "description": "Formato (ej. 20 Comprimidos, Jarabe 120ml)"
          },
          "brand": {
            "type": "string",
            "description": "Laboratorio o marca comercial"
          },
          "bioequivalent": {
            "type": "boolean",
            "description": "Indica si está marcado como bioequivalente / genérico"
          },
          "prescription_required": {
            "type": "boolean",
            "description": "Indica si requiere receta médica"
          },
          "price_regular": {
            "type": "integer",
            "description": "Precio normal en CLP (número entero)"
          },
          "price_offer": {
            "type": ["integer", "null"],
            "description": "Precio en oferta / suscripción en CLP si aplica"
          },
          "unit_price_description": {
            "type": ["string", "null"],
            "description": "Precio por unidad de medida (ej. $150 x Comprimido)"
          },
          "currency": {
            "type": "string",
            "default": "CLP"
          },
          "in_stock": {
            "type": "boolean"
          },
          "image_url": {
            "type": ["string", "null"],
            "format": "uri"
          },
          "product_url": {
            "type": "string",
            "format": "uri"
          },
          "category": {
            "type": ["string", "null"]
          }
        }
      }
    }
  }
}
