{
  "scraped_at": "2026-08-29T21:18:00Z",
  "pharmacy_name": "Cruz Verde",
  "source_url": "https://www.cruzverde.cl/buscar?q=paracetamol",
  "items_count": 1,
  "products": [
    {
      "sku": "CV-109283",
      "name": "Paracetamol 500 mg 20 Comprimidos",
      "active_ingredient": null,
      "dosage": null,
      "presentation": null,
      "brand": "Laboratorio Chile",
      "bioequivalent": false,
      "prescription_required": false,
      "price_regular": 1290,
      "price_offer": 990,
      "unit_price_description": null,
      "currency": "CLP",
      "in_stock": true,
      "image_url": "https://images.cruzverde.cl/products/109283.jpg",
      "product_url": "https://www.cruzverde.cl/paracetamol-500-mg-20-comprimidos/109283.html",
      "category": null
    }
  ]
}